{
  "artifact": "placement_results",
  "artifact_schema_version": "1.0",
  "assessment": "MODELED_FEASIBLE",
  "conditions": [],
  "disclaimer": "Requested-resource model only. MODELED_FEASIBLE is not SAFE_TO_DRAIN: it does not predict the Kubernetes scheduler's choices, does not simulate controller reconciliation, and does not establish that evictions will be permitted by PodDisruptionBudgets.",
  "exact": {
    "assignments": [
      {
        "node": "node-db",
        "pod": "data/db-1a2b3c-aaaaa"
      },
      {
        "node": "node-general",
        "pod": "web/front-2b3c4d-aaaaa"
      },
      {
        "node": "node-general",
        "pod": "web/front-2b3c4d-bbbbb"
      }
    ],
    "config": {
      "deadline_seconds": null,
      "max_candidates": 8,
      "max_destinations": 6,
      "max_states": 2000000
    },
    "metrics": {
      "assigned": 3,
      "candidates": 3,
      "unplaced": 0,
      "verified": true
    },
    "objective": {
      "assigned": 3,
      "balance_leximin": [
        "0/1",
        "3/4"
      ],
      "min_free_fraction": "0/1"
    },
    "optimality_proven": true,
    "outcome": "COMPLETE",
    "remaining_capacity": [
      {
        "assigned": {
          "cpu_millicores": 2000,
          "memory_bytes": 4294967296,
          "pods": 1
        },
        "node": "node-db",
        "remaining_after": {
          "cpu_millicores": 6000,
          "memory_bytes": 30064771072,
          "pods": 109
        },
        "usable": true
      },
      {
        "assigned": {
          "cpu_millicores": 1000,
          "memory_bytes": 2147483648,
          "pods": 2
        },
        "node": "node-general",
        "remaining_after": {
          "cpu_millicores": 0,
          "memory_bytes": 0,
          "pods": 108
        },
        "usable": true
      }
    ],
    "search": {
      "branches_pruned": 3,
      "states_explored": 7
    },
    "solver": "exact-bnb-v1",
    "termination": "SEARCH_COMPLETED",
    "unplaced": [],
    "verification": {
      "errors": [],
      "node_usage": [
        {
          "assigned": {
            "cpu_millicores": 2000,
            "memory_bytes": 4294967296,
            "pods": 1
          },
          "assigned_pods": [
            "data/db-1a2b3c-aaaaa"
          ],
          "node": "node-db",
          "remaining_after": {
            "cpu_millicores": 6000,
            "memory_bytes": 30064771072,
            "pods": 109
          },
          "remaining_before": {
            "cpu_millicores": 8000,
            "memory_bytes": 34359738368,
            "pods": 110
          }
        },
        {
          "assigned": {
            "cpu_millicores": 1000,
            "memory_bytes": 2147483648,
            "pods": 2
          },
          "assigned_pods": [
            "web/front-2b3c4d-aaaaa",
            "web/front-2b3c4d-bbbbb"
          ],
          "node": "node-general",
          "remaining_after": {
            "cpu_millicores": 0,
            "memory_bytes": 0,
            "pods": 108
          },
          "remaining_before": {
            "cpu_millicores": 1000,
            "memory_bytes": 2147483648,
            "pods": 110
          }
        }
      ],
      "review_required": [],
      "valid": true
    }
  },
  "findings": [
    "COMPLETE_ASSIGNMENT_FOUND"
  ],
  "generator": {
    "milestone": "M2",
    "name": "qplace",
    "version": "0.1.0"
  },
  "greedy": {
    "assignments": [
      {
        "node": "node-db",
        "pod": "data/db-1a2b3c-aaaaa"
      },
      {
        "node": "node-general",
        "pod": "web/front-2b3c4d-aaaaa"
      },
      {
        "node": "node-general",
        "pod": "web/front-2b3c4d-bbbbb"
      }
    ],
    "config": {
      "candidate_order": "cpu desc, memory desc, pod key asc",
      "destination_order": "node name asc"
    },
    "metrics": {
      "assigned": 3,
      "candidates": 3,
      "unplaced": 0,
      "verified": true
    },
    "objective": {
      "assigned": 3,
      "balance_leximin": [
        "0/1",
        "3/4"
      ],
      "min_free_fraction": "0/1"
    },
    "optimality_proven": false,
    "outcome": "COMPLETE",
    "remaining_capacity": [
      {
        "assigned": {
          "cpu_millicores": 2000,
          "memory_bytes": 4294967296,
          "pods": 1
        },
        "node": "node-db",
        "remaining_after": {
          "cpu_millicores": 6000,
          "memory_bytes": 30064771072,
          "pods": 109
        },
        "usable": true
      },
      {
        "assigned": {
          "cpu_millicores": 1000,
          "memory_bytes": 2147483648,
          "pods": 2
        },
        "node": "node-general",
        "remaining_after": {
          "cpu_millicores": 0,
          "memory_bytes": 0,
          "pods": 108
        },
        "usable": true
      }
    ],
    "search": {
      "branches_pruned": 0,
      "states_explored": 3
    },
    "solver": "greedy-ffd-v1",
    "termination": "COMPLETED",
    "unplaced": [],
    "verification": {
      "errors": [],
      "node_usage": [
        {
          "assigned": {
            "cpu_millicores": 2000,
            "memory_bytes": 4294967296,
            "pods": 1
          },
          "assigned_pods": [
            "data/db-1a2b3c-aaaaa"
          ],
          "node": "node-db",
          "remaining_after": {
            "cpu_millicores": 6000,
            "memory_bytes": 30064771072,
            "pods": 109
          },
          "remaining_before": {
            "cpu_millicores": 8000,
            "memory_bytes": 34359738368,
            "pods": 110
          }
        },
        {
          "assigned": {
            "cpu_millicores": 1000,
            "memory_bytes": 2147483648,
            "pods": 2
          },
          "assigned_pods": [
            "web/front-2b3c4d-aaaaa",
            "web/front-2b3c4d-bbbbb"
          ],
          "node": "node-general",
          "remaining_after": {
            "cpu_millicores": 0,
            "memory_bytes": 0,
            "pods": 108
          },
          "remaining_before": {
            "cpu_millicores": 1000,
            "memory_bytes": 2147483648,
            "pods": 110
          }
        }
      ],
      "review_required": [],
      "valid": true
    }
  },
  "greedy_gap": 0,
  "limitations": [
    {
      "code": "REPLACEMENT_TEMPLATE_UNKNOWN",
      "detail": "replacement modeled from the current pod spec",
      "subject": "data/db-1a2b3c-aaaaa"
    },
    {
      "code": "REPLACEMENT_TEMPLATE_UNKNOWN",
      "detail": "replacement modeled from the current pod spec",
      "subject": "web/front-2b3c4d-aaaaa"
    },
    {
      "code": "REPLACEMENT_TEMPLATE_UNKNOWN",
      "detail": "replacement modeled from the current pod spec",
      "subject": "web/front-2b3c4d-bbbbb"
    }
  ],
  "source": {
    "capacity_assessment_complete": true,
    "captured_at": "2026-10-10T09:00:00Z",
    "kubernetes_version": "v1.34.1",
    "snapshot_id": "m2-scenario-d-eligibility",
    "snapshot_schema_version": "1.0",
    "source_file": "scenario_d_eligibility.json",
    "source_sha256": "db51a686c6be132912f4446a006a90d1e742e9e88ee232ea395766220789f690",
    "source_type": "synthetic_fixture"
  },
  "target_node": "source",
  "verified_assignments": [
    {
      "node": "node-db",
      "pod": "data/db-1a2b3c-aaaaa"
    },
    {
      "node": "node-general",
      "pod": "web/front-2b3c4d-aaaaa"
    },
    {
      "node": "node-general",
      "pod": "web/front-2b3c4d-bbbbb"
    }
  ],
  "verified_assignments_source": "exact"
}
