{
  "artifact": "placement_results",
  "artifact_schema_version": "1.0",
  "assessment": "MODELED_BLOCKED",
  "conditions": [],
  "disclaimer": "Requested-resource model only. MODELED_FEASIBLE is not SAFE_TO_DRAIN: it does not predict the Kubernetes scheduler's choices, does not simulate controller reconciliation, and does not establish that evictions will be permitted by PodDisruptionBudgets.",
  "exact": {
    "assignments": [
      {
        "node": "node-1",
        "pod": "apps/tiny-6f7a8b-aaaaa"
      }
    ],
    "config": {
      "deadline_seconds": null,
      "max_candidates": 8,
      "max_destinations": 6,
      "max_states": 2000000
    },
    "metrics": {
      "assigned": 1,
      "candidates": 2,
      "unplaced": 1,
      "verified": true
    },
    "objective": {
      "assigned": 1,
      "balance_leximin": [
        "0/1",
        "1/1"
      ],
      "min_free_fraction": "0/1"
    },
    "optimality_proven": true,
    "outcome": "PARTIAL",
    "remaining_capacity": [
      {
        "assigned": {
          "cpu_millicores": 100,
          "memory_bytes": 134217728,
          "pods": 1
        },
        "node": "node-1",
        "remaining_after": {
          "cpu_millicores": 7800,
          "memory_bytes": 34091302912,
          "pods": 0
        },
        "usable": true
      },
      {
        "assigned": {
          "cpu_millicores": 0,
          "memory_bytes": 0,
          "pods": 0
        },
        "node": "node-2",
        "remaining_after": {
          "cpu_millicores": 8000,
          "memory_bytes": 34359738368,
          "pods": 110
        },
        "usable": true
      }
    ],
    "search": {
      "branches_pruned": 1,
      "states_explored": 6
    },
    "solver": "exact-bnb-v1",
    "termination": "SEARCH_COMPLETED",
    "unplaced": [
      {
        "pod": "apps/tiny-6f7a8b-bbbbb",
        "reasons": [
          "NOT_SELECTED"
        ],
        "rejections": []
      }
    ],
    "verification": {
      "errors": [],
      "node_usage": [
        {
          "assigned": {
            "cpu_millicores": 100,
            "memory_bytes": 134217728,
            "pods": 1
          },
          "assigned_pods": [
            "apps/tiny-6f7a8b-aaaaa"
          ],
          "node": "node-1",
          "remaining_after": {
            "cpu_millicores": 7800,
            "memory_bytes": 34091302912,
            "pods": 0
          },
          "remaining_before": {
            "cpu_millicores": 7900,
            "memory_bytes": 34225520640,
            "pods": 1
          }
        }
      ],
      "review_required": [],
      "valid": true
    }
  },
  "findings": [
    "COMPLETE_ASSIGNMENT_IMPOSSIBLE_IN_MODEL",
    "KNOWN_SHORTAGE_AMONG_MODELED_CANDIDATES"
  ],
  "generator": {
    "milestone": "M2",
    "name": "qplace",
    "version": "0.1.0"
  },
  "greedy": {
    "assignments": [
      {
        "node": "node-1",
        "pod": "apps/tiny-6f7a8b-aaaaa"
      }
    ],
    "config": {
      "candidate_order": "cpu desc, memory desc, pod key asc",
      "destination_order": "node name asc"
    },
    "metrics": {
      "assigned": 1,
      "candidates": 2,
      "unplaced": 1,
      "verified": true
    },
    "objective": {
      "assigned": 1,
      "balance_leximin": [
        "0/1",
        "1/1"
      ],
      "min_free_fraction": "0/1"
    },
    "optimality_proven": false,
    "outcome": "PARTIAL",
    "remaining_capacity": [
      {
        "assigned": {
          "cpu_millicores": 100,
          "memory_bytes": 134217728,
          "pods": 1
        },
        "node": "node-1",
        "remaining_after": {
          "cpu_millicores": 7800,
          "memory_bytes": 34091302912,
          "pods": 0
        },
        "usable": true
      },
      {
        "assigned": {
          "cpu_millicores": 0,
          "memory_bytes": 0,
          "pods": 0
        },
        "node": "node-2",
        "remaining_after": {
          "cpu_millicores": 8000,
          "memory_bytes": 34359738368,
          "pods": 110
        },
        "usable": true
      }
    ],
    "search": {
      "branches_pruned": 0,
      "states_explored": 2
    },
    "solver": "greedy-ffd-v1",
    "termination": "COMPLETED",
    "unplaced": [
      {
        "pod": "apps/tiny-6f7a8b-bbbbb",
        "reasons": [
          "NOT_SELECTED"
        ],
        "rejections": [
          {
            "code": "INSUFFICIENT_POD_SLOTS",
            "detail": "has 0",
            "node": "node-1"
          },
          {
            "code": "NOT_ELIGIBLE",
            "detail": "M1 eligibility INELIGIBLE",
            "node": "node-2"
          }
        ]
      }
    ],
    "verification": {
      "errors": [],
      "node_usage": [
        {
          "assigned": {
            "cpu_millicores": 100,
            "memory_bytes": 134217728,
            "pods": 1
          },
          "assigned_pods": [
            "apps/tiny-6f7a8b-aaaaa"
          ],
          "node": "node-1",
          "remaining_after": {
            "cpu_millicores": 7800,
            "memory_bytes": 34091302912,
            "pods": 0
          },
          "remaining_before": {
            "cpu_millicores": 7900,
            "memory_bytes": 34225520640,
            "pods": 1
          }
        }
      ],
      "review_required": [],
      "valid": true
    }
  },
  "greedy_gap": 0,
  "limitations": [
    {
      "code": "REPLACEMENT_TEMPLATE_UNKNOWN",
      "detail": "replacement modeled from the current pod spec",
      "subject": "apps/tiny-6f7a8b-aaaaa"
    },
    {
      "code": "REPLACEMENT_TEMPLATE_UNKNOWN",
      "detail": "replacement modeled from the current pod spec",
      "subject": "apps/tiny-6f7a8b-bbbbb"
    }
  ],
  "source": {
    "capacity_assessment_complete": true,
    "captured_at": "2026-10-10T09:00:00Z",
    "kubernetes_version": "v1.34.1",
    "snapshot_id": "m2-scenario-f-pod-slots",
    "snapshot_schema_version": "1.0",
    "source_file": "scenario_f_pod_slots.json",
    "source_sha256": "b285404b3f20ebc7b5ced01fa9b2ee582806df1816d08939e2bdc3221e621587",
    "source_type": "synthetic_fixture"
  },
  "target_node": "source",
  "verified_assignments": [
    {
      "node": "node-1",
      "pod": "apps/tiny-6f7a8b-aaaaa"
    }
  ],
  "verified_assignments_source": "exact"
}
